{
  "schemaVersion": 1,
  "name": "business-plan",
  "displayName": "Business Plan",
  "description": "Structured business planning and business-analysis workflow for business plans, investor-ready financial analysis, market sizing, pitch deck narrative, strategic review, and valuation. Best for substantive commercial deliverables rather than open-ended ideation, pure research, or final file production.",
  "version": "1.1.0",
  "maturity": "stable",
  "categories": ["business", "productivity", "workflow"],
  "tags": [
    "business-plan",
    "financial-analysis",
    "market-analysis",
    "pitch-deck",
    "valuation",
    "strategy",
    "SWOT",
    "business-model",
    "unit-economics",
    "competitive-analysis",
    "fundraising"
  ],
  "authors": [
    {
      "name": "Qiongyu Li"
    }
  ],
  "entrypoints": {
    "skillDoc": "SKILL.md",
    "changelog": "CHANGELOG.md"
  },
  "capabilities": {
    "shell": false,
    "network": true,
    "filesystemRead": true,
    "filesystemWrite": true
  }
}
