{
  "schemaVersion": 1,
  "name": "skill-researcher",
  "displayName": "Skill Researcher",
  "description": "Survey community skills, require candidate confirmation before deeper analysis, and produce structured fusion reports as handoff artifacts for downstream skill creation.",
  "version": "0.2.0",
  "maturity": "experimental",
  "categories": [
    "research",
    "workflow"
  ],
  "tags": [
    "skill-discovery",
    "fusion",
    "community-skills",
    "ecosystem-research",
    "skill-creation"
  ],
  "authors": [
    {
      "name": "Qiongyu Li"
    }
  ],
  "entrypoints": {
    "skillDoc": "SKILL.md",
    "changelog": "CHANGELOG.md"
  },
  "requirements": {
    "network": "optional"
  },
  "capabilities": {
    "shell": true,
    "network": true,
    "filesystemRead": true,
    "filesystemWrite": true
  }
}
