{
  "schemaVersion": 1,
  "name": "priority-scoring",
  "displayName": "Priority Scoring",
  "description": "Manual-first workflow for scoring a normalized or shaped issue for relative urgency and queue placement using impact, urgency, reversibility, dependency pressure, and confidence. Use after issue intake or shaping when the next need is a governance-ready priority recommendation, not implementation planning or risk gating.",
  "version": "0.1.0",
  "maturity": "experimental",
  "categories": ["workflow", "productivity", "business"],
  "tags": ["priority", "triage", "admission", "queueing", "backlog"],
  "authors": [
    {
      "name": "Qiongyu Li"
    }
  ],
  "entrypoints": {
    "skillDoc": "SKILL.md",
    "changelog": "CHANGELOG.md"
  },
  "capabilities": {
    "shell": true,
    "network": false,
    "filesystemRead": true,
    "filesystemWrite": true
  }
}
