{
  "schemaVersion": 1,
  "name": "risk-gating",
  "displayName": "Risk Gating",
  "description": "Manual-first workflow for deciding whether an issue, run, or change can proceed under current risk conditions and which mitigations, specialists, or approval gates are required. Use for governance and go/no-go boundary setting, not backlog prioritization or final acceptance verification.",
  "version": "0.1.0",
  "maturity": "experimental",
  "categories": ["workflow", "security", "productivity"],
  "tags": ["risk", "gate", "mitigation", "governance", "approval"],
  "authors": [
    {
      "name": "Qiongyu Li"
    }
  ],
  "entrypoints": {
    "skillDoc": "SKILL.md",
    "changelog": "CHANGELOG.md"
  },
  "capabilities": {
    "shell": true,
    "network": false,
    "filesystemRead": true,
    "filesystemWrite": true
  }
}
