{
  "schemaVersion": 1,
  "name": "execution-briefing",
  "displayName": "Execution Briefing",
  "description": "Manual-first workflow for converting a shaped issue into an execution-ready brief, optional approval checkpoint, and initial done contract for a run. Use when the issue boundary is already chosen and the next need is a clear run brief, verification focus, gate framing, or pre-execution handoff before execution. Do not use for raw intake, issue shaping, backlog prioritization, or deep implementation planning.",
  "version": "0.2.0",
  "maturity": "experimental",
  "categories": ["workflow", "coding", "productivity"],
  "tags": [
    "execution-briefing",
    "execution-brief",
    "done-contract",
    "handoff",
    "run-brief",
    "verification",
    "approval-checkpoint"
  ],
  "authors": [
    {
      "name": "Qiongyu Li"
    }
  ],
  "entrypoints": {
    "skillDoc": "SKILL.md",
    "changelog": "CHANGELOG.md"
  },
  "capabilities": {
    "shell": true,
    "network": false,
    "filesystemRead": true,
    "filesystemWrite": true
  }
}
