{
  "schemaVersion": 1,
  "name": "handoff-bundle-writing",
  "displayName": "Handoff Bundle Writing",
  "description": "Manual-first workflow for turning an in-progress, paused, interrupted, or transferred run into a structured handoff bundle with current state, completed work, remaining work, blockers, next step, and artifact references for safe resume. Use when execution has already started and the next need is transfer, pause, or recovery context. Do not use for pre-execution briefing, memory writeback, generic summarization, or run-state sync.",
  "version": "0.1.0",
  "maturity": "experimental",
  "categories": ["workflow", "coding", "productivity"],
  "tags": [
    "handoff-bundle-writing",
    "handoff-bundle",
    "handoff",
    "resume",
    "transfer-context",
    "artifact"
  ],
  "authors": [
    {
      "name": "Qiongyu Li"
    }
  ],
  "entrypoints": {
    "skillDoc": "SKILL.md",
    "changelog": "CHANGELOG.md"
  },
  "capabilities": {
    "shell": true,
    "network": false,
    "filesystemRead": true,
    "filesystemWrite": true
  }
}
