{
  "schemaVersion": 1,
  "name": "backlog-curation",
  "displayName": "Backlog Curation",
  "description": "Manual-first workflow for curating backlog state after execution, review, or learning passes: deduping, recycling, follow-up issue generation, and closure hygiene. Use when the next need is backlog cleanliness and durable work tracking, not fresh intake or queue prioritization.",
  "version": "0.1.0",
  "maturity": "experimental",
  "categories": ["workflow", "productivity", "design"],
  "tags": ["backlog", "curation", "dedupe", "follow-up", "recycle"],
  "authors": [
    {
      "name": "Qiongyu Li"
    }
  ],
  "entrypoints": {
    "skillDoc": "SKILL.md",
    "changelog": "CHANGELOG.md"
  },
  "capabilities": {
    "shell": true,
    "network": false,
    "filesystemRead": true,
    "filesystemWrite": true
  }
}
