{
  "schemaVersion": 1,
  "name": "deep-research",
  "displayName": "Deep Research",
  "description": "Conduct comprehensive, citation-backed web research with multi-phase pipeline, parallel execution, anti-hallucination protocols, and structured report generation.",
  "version": "0.3.0",
  "maturity": "experimental",
  "categories": [
    "research",
    "productivity"
  ],
  "tags": [
    "research",
    "analysis",
    "web-search",
    "citations",
    "report"
  ],
  "authors": [
    {
      "name": "Qiongyu Li"
    }
  ],
  "entrypoints": {
    "skillDoc": "SKILL.md",
    "changelog": "CHANGELOG.md"
  },
  "requirements": {
    "network": "required"
  },
  "capabilities": {
    "shell": true,
    "network": true,
    "filesystemWrite": true
  }
}
