{
  "schemaVersion": 1,
  "name": "agentic-development",
  "displayName": "Agentic Development",
  "description": "Manual-first workflow for designing, building, evaluating, and upgrading real agentic systems. Use when the job involves tool-using agents, agent orchestration, agent runtimes or platforms, multi-agent systems, framework selection, evals, or guardrails; do not use for prompt-only work or ordinary implementation planning.",
  "version": "0.1.2",
  "maturity": "experimental",
  "categories": ["ai", "workflow", "design"],
  "tags": [
    "agentic-development",
    "agent-engineering",
    "agent-architecture",
    "multi-agent",
    "tool-use",
    "memory",
    "guardrails",
    "evals",
    "framework-selection",
    "mcp"
  ],
  "authors": [
    {
      "name": "Qiongyu Li"
    }
  ],
  "entrypoints": {
    "skillDoc": "SKILL.md",
    "changelog": "CHANGELOG.md"
  },
  "requirements": {
    "network": "optional"
  },
  "capabilities": {
    "shell": true,
    "network": true,
    "filesystemRead": true,
    "filesystemWrite": true
  }
}
