{
  "schemaVersion": 1,
  "name": "issue-shaping",
  "displayName": "Issue Shaping",
  "description": "Manual-first workflow for turning a normalized issue into a shaped, execution-ready work item with clear scope, non-goals, acceptance criteria, dependencies, and next-step routing. Use when an issue already exists but still needs boundary tightening, execution-readiness judgment, or a decomposition recommendation before admission or execution. Do not use for raw issue intake, backlog prioritization, or detailed implementation planning.",
  "version": "0.1.0",
  "maturity": "experimental",
  "categories": ["workflow", "design", "productivity"],
  "tags": [
    "issue-shaping",
    "scope-shaping",
    "acceptance-criteria",
    "non-goals",
    "execution-readiness",
    "decomposition"
  ],
  "authors": [
    {
      "name": "Qiongyu Li"
    }
  ],
  "entrypoints": {
    "skillDoc": "SKILL.md",
    "changelog": "CHANGELOG.md"
  },
  "capabilities": {
    "shell": true,
    "network": false,
    "filesystemRead": true,
    "filesystemWrite": true
  }
}
