{
  "schemaVersion": 1,
  "name": "artifact-linking",
  "displayName": "Artifact Linking",
  "description": "Manual-first workflow for linking issue, run, change, verification, and handoff artifacts together and exposing those refs cleanly on projection surfaces. Use when artifact traceability matters more than generic synchronization or summary writing.",
  "version": "0.1.0",
  "maturity": "experimental",
  "categories": ["workflow", "documentation", "productivity"],
  "tags": ["artifact", "linking", "traceability", "refs", "projection"],
  "authors": [
    {
      "name": "Qiongyu Li"
    }
  ],
  "entrypoints": {
    "skillDoc": "SKILL.md",
    "changelog": "CHANGELOG.md"
  },
  "capabilities": {
    "shell": true,
    "network": false,
    "filesystemRead": true,
    "filesystemWrite": true
  }
}
