{
  "schemaVersion": 1,
  "name": "budget-decision",
  "displayName": "Budget Decision",
  "description": "Manual-first workflow for proposing or revising a run budget envelope, including loop limits, specialist-call limits, and escalation thresholds. Use when governance needs an explicit execution budget decision rather than issue shaping, risk gating, or implementation planning.",
  "version": "0.1.0",
  "maturity": "experimental",
  "categories": ["workflow", "productivity", "business"],
  "tags": ["budget", "run-budget", "limits", "escalation", "governance"],
  "authors": [
    {
      "name": "Qiongyu Li"
    }
  ],
  "entrypoints": {
    "skillDoc": "SKILL.md",
    "changelog": "CHANGELOG.md"
  },
  "capabilities": {
    "shell": true,
    "network": false,
    "filesystemRead": true,
    "filesystemWrite": true
  }
}
