{
  "schemaVersion": 1,
  "name": "readme-craftsman",
  "displayName": "README Craftsman",
  "description": "Generate, update, or review README.md files with deep codebase analysis, project-type-aware templates, and quality validation. Covers OSS libraries, web services, CLI tools, personal projects, internal tools, monorepos, and config directories.",
  "version": "1.1.1",
  "maturity": "stable",
  "categories": ["documentation", "workflow", "productivity"],
  "tags": ["readme", "documentation", "markdown", "github", "project-docs", "open-source"],
  "authors": [
    {
      "name": "Qiongyu Li"
    }
  ],
  "entrypoints": {
    "skillDoc": "SKILL.md",
    "changelog": "CHANGELOG.md"
  },
  "capabilities": {
    "shell": true,
    "network": false,
    "filesystemRead": true,
    "filesystemWrite": true
  }
}
